{
  "schema_version": "3.0.0",
  "references": [
    {
      "path": "references/reference-01.png",
      "role": "style_reference",
      "notes": "original reference retained in this Style Pack"
    }
  ],
  "evidence_scope": {
    "reference_count": 1,
    "generalization": "single-reference-hypothesis"
  },
  "style_summary": "宽幅白底学术技术图，以粗黑宏观框、浅灰标题带、三级容器、实线主流程与暖色虚线反馈形成紧凑工程叙事；酒红、橙黄、青蓝保留为可重新映射的强调色槽位，大号衬线分区标题与粗体无衬线节点文字形成学术层级反差。",
  "signature_anchors": [
    {
      "id": "framed-asymmetric-panels",
      "dimension": "layout",
      "rule": "粗黑外框组织非对称宽度的宏观分区，较宽主区可局部上下分层；分区数量、比例和阅读路径按新内容拓扑重算。",
      "evidence": ["整图宏观分区具有明显宽度差", "最大区域存在上下层级"],
      "weight": 24,
      "confidence": "high",
      "prompt_token": "保留非对称宽度节奏、粗黑宏观边界、严格对齐和局部上下分层的视觉语言，不固定某一业务位置。"
    },
    {
      "id": "header-band-nested-containers",
      "dimension": "components",
      "rule": "浅灰标题带、白色主面板、彩色圆角机制框与局部暖色虚线子框构成三级容器。",
      "evidence": ["各宏观面板顶部重复浅灰标题带", "主面板内部重复出现彩色框与虚线子框"],
      "weight": 18,
      "confidence": "high",
      "prompt_token": "每个宏观区顶部设置浅灰标题带，白色主面板内嵌彩色机制框和暖色虚线子框，形成三级容器。"
    },
    {
      "id": "solid-flow-dashed-feedback",
      "dimension": "connectors",
      "rule": "黑色粗实线空心箭头表达主流程，酒红或暖色虚线曲线表达反馈、映射和跨区关联。",
      "evidence": ["主路径持续使用黑色实线箭头", "次级跨区关系使用暖色虚线"],
      "weight": 16,
      "confidence": "high",
      "prompt_token": "主流程使用粗黑实线和白心三角箭头，反馈、映射或跨区关联使用酒红或暖色虚线曲线。"
    },
    {
      "id": "reassignable-triad-palette",
      "dimension": "palette",
      "rule": "黑白灰承担结构，酒红、橙黄、青蓝作为三组强调色槽位；色值与面积关系稳定，具体业务语义随新内容重映射。",
      "evidence": ["黑色框线与浅灰标题带构成骨架", "三组高辨识度功能色反复出现"],
      "weight": 14,
      "confidence": "high",
      "prompt_token": "以黑白灰构建版式骨架，酒红、橙黄、青蓝作为中性强调色槽位，并按新内容层级重新映射语义。"
    },
    {
      "id": "academic-type-contrast",
      "dimension": "typography",
      "rule": "宏观标题使用大号高字重衬线体，节点与说明使用粗体或常规无衬线体，公式可使用斜体衬线。",
      "evidence": ["分区标题具有明显衬线与高字重", "节点说明使用紧凑无衬线体"],
      "weight": 12,
      "confidence": "high",
      "prompt_token": "分区标题使用大号高字重衬线中文字体，节点标题使用粗体无衬线中文字体，短注释使用中等字重无衬线。"
    },
    {
      "id": "flat-line-icons-with-accents",
      "dimension": "iconography",
      "rule": "内容对象使用正视角扁平线稿和小面积功能色表达；具体题材从新内容实体、对象与动作中派生。",
      "evidence": ["图标普遍使用深色线稿与少量填色", "图标与短标签绑定并保持统一视角"],
      "weight": 8,
      "confidence": "medium",
      "prompt_token": "图标采用正视角扁平线稿，深色轮廓约 2 像素，内部只使用一至两种功能色。"
    },
    {
      "id": "dense-grid-clear-hierarchy",
      "dimension": "density",
      "rule": "高信息密度依靠严格网格、重复卡片尺度、短标签和局部留白维持可扫读性。",
      "evidence": ["重复步骤紧凑排列", "各区边缘保留均匀安全距"],
      "weight": 8,
      "confidence": "high",
      "prompt_token": "采用紧凑工程网格，每个主区放 2–5 个短标签，重复卡片等高等宽。"
    }
  ],
  "visual_system": {
    "layout": {
      "observations": ["宽幅横版", "宏观分区宽度非对称", "较宽主区存在上下分层", "主方向清楚并含局部纵向路径"],
      "transfer_rules": ["根据新内容拓扑重算主区数量、相对宽度、上下层级和阅读路径。", "保留非对称宽度节奏、粗黑宏观边界、严格对齐和局部上下分层的视觉语言，不固定某一业务位置。"]
    },
    "components": {
      "observations": ["粗黑直角外框", "浅灰标题带", "白底主面板", "彩色圆角框与暖色虚线子框"],
      "transfer_rules": ["外层宏观分区使用直角粗黑框，机制节点使用小圆角彩色框。", "每个宏观区顶部设置浅灰标题带，白色主面板内嵌彩色机制框和暖色虚线子框，形成三级容器。"]
    },
    "connectors": {
      "observations": ["实线主流程", "虚线反馈或映射", "白心三角箭头", "跨区连线贴边路由"],
      "transfer_rules": ["只为真实关系绘制箭头。", "主线与反馈线使用不同颜色和线型。", "主流程使用粗黑实线和白心三角箭头，反馈、映射或跨区关联使用酒红或暖色虚线曲线。"]
    },
    "palette": {
      "observations": ["背景 #FFFFFF", "标题带 #F1F1F1", "文字与结构线 #151515", "强调色组 #A64573/#67364F、#FF8B38/#F8B52B、#09C9D1/#0B4AA2"],
      "transfer_rules": ["背景使用 #FFFFFF，宏观标题带使用 #F1F1F1，主体文字和结构线使用 #151515。", "强调色 A 使用 #A64573 与 #67364F，强调色 B 使用 #FF8B38 与 #F8B52B，强调色 C 使用 #09C9D1 与 #0B4AA2。", "根据新内容层级、分组与关系重新分配强调色 A、B、C 的具体语义。", "功能色控制在 20%–28%。"]
    },
    "typography": {
      "observations": ["大号高字重衬线分区标题", "粗体无衬线节点", "少量斜体公式"],
      "transfer_rules": ["中文可使用思源宋体或宋体作为标题替代，思源黑体或黑体作为正文替代。", "短注释不超过两行。", "分区标题使用大号高字重衬线中文字体，节点标题使用粗体无衬线中文字体，短注释使用中等字重无衬线。"]
    },
    "iconography": {
      "observations": ["线稿与小面积填色结合", "统一正视角", "中低细节复杂度", "图标与短标签绑定"],
      "transfer_rules": ["根据新内容中的实体、对象与动作选择图标或插图题材。", "图标采用正视角扁平线稿，深色轮廓约 2 像素，内部只使用一至两种功能色。", "图标只帮助识别对象，精确技术含义由文字和连接关系表达。"]
    },
    "surface": {
      "observations": ["纯白平面背景", "深度来自描边、嵌套与色块对比", "未观察到渐变与立体阴影"],
      "transfer_rules": ["默认采用纯平面印刷质感，层级主要来自描边、容器嵌套和色块对比。", "用户提供或内容必需的辅助素材用统一边框、裁切、色调和尺度纳入组件系统。"]
    },
    "density": {
      "observations": ["高密度但标签短", "重复模块节奏统一", "宏观边界清楚", "安全距均匀"],
      "transfer_rules": ["采用紧凑工程网格，每个主区放 2–5 个短标签，重复卡片等高等宽。", "通过层级与网格压缩信息，不使用不可读的小字号。"]
    }
  },
  "transfer_boundary": {
    "layout_policy": "preserve-visual-rhythm-adapt-to-new-topology",
    "icon_subject_policy": "derive-from-new-content",
    "color_role_policy": "assign-by-new-content-hierarchy",
    "supporting_asset_policy": "allow-user-provided-or-content-required",
    "hard_constraints": ["内容与逐字文字准确，不编造未提供的信息。", "节点关系、方向和拓扑正确，不带入源主题内容。", "文字清晰，画面无裁切、越界、遮挡和连线穿字。"],
    "style_defaults": ["默认采用纯平面印刷质感、清楚描边和克制装饰。", "特殊表面效果仅在用户明确要求或内容确有需要时采用。"]
  },
  "conditional_rules": ["主区数量与比例随新内容拓扑变化，保留非对称节奏和宏观边界语言。", "图标题材随新内容变化，保持统一线稿、视角、抽象度和功能色数量。", "用户提供或内容必需的标识、照片与外部插图允许作为 supporting insert，并按组件语言整合。"],
  "anti_generic": ["不要把所有信息压成同款圆角卡片；保留粗黑宏观区、浅灰标题带、暖色虚线子框和彩色机制框的层级差。", "不要只复用酒红和橙色；同时保留非对称多面板、学术字体反差、实线主流程与虚线反馈。", "不要机械复刻参考图的分区数量、业务位置、图标题材或色彩业务含义；按新内容重新规划与映射。"],
  "source_exclusions": ["literal:Overall Pipeline", "literal:Skill Compiler", "literal:Inference Stage", "literal:Reconstruction Loss", "literal:Completion Loss", "源图 Logo、公式符号、数据量和专有对象组合"]
}
