{
  "schema_version": "3.0.0",
  "references": [
    {
      "path": "references/reference-01.png",
      "role": "style_reference",
      "notes": "original reference retained in this Style Pack"
    }
  ],
  "evidence_scope": {
    "reference_count": 1,
    "generalization": "single-reference-hypothesis"
  },
  "style_summary": "白底宽幅多面板方法图，靠四级容器嵌套建立层级：独立浅灰圆角标题条压在顶部，下面是灰色虚线圆角宏观框，框内是低饱和淡彩实心内卡，内卡里再嵌白色小微卡。分区靠色相编码而非线框粗细，同一主模块内统一色相、跨模块才换色，填充明度都在 90% 以上。关系语言收敛到唯一一种纯黑细实线直角三角箭头，虚线只做分组、跨模块转折改用大面积淡彩实心三角。插画是 3-5 色块的无阴影扁平矢量，卡通人物胸像与对象图标、几何示意共用同一套画法与视觉重量。模块之间留大白沟槽、模块内部紧密排列，形成外松内紧的密度节奏。",
  "signature_anchors": [
    {
      "id": "four-level-nesting",
      "dimension": "components",
      "rule": "独立浅灰圆角标题条（不与内容共边框）→ 灰色 1px 虚线圆角宏观框 → 淡彩实心圆角内卡 → 白色小微卡，四级各有不同填充与描边语言，层级差肉眼可辨，嵌套深度固定四级不再加层",
      "evidence": [
        "四个主面板顶部均为脱开的浅灰标题条",
        "每个面板内部虚线大框套彩色卡再套白色小方块"
      ],
      "weight": 20,
      "confidence": "high",
      "prompt_token": "浅灰圆角标题条脱开悬于虚线圆角宏观框上方，框内排布淡彩实心内卡，内卡中再嵌白色小微卡，形成四级可辨层级"
    },
    {
      "id": "hue-coded-pastel-zones",
      "dimension": "palette",
      "rule": "分区靠淡彩色相编码：同一主模块内所有卡片共用一个色相的深浅变化，跨模块才换色相；填充明度 90%-96%、饱和度低于 25%，描边取同色系加深值，高饱和只出现在图标内部与功能微标记，总面积不超过 8%",
      "evidence": [
        "蓝黄绿紫粉五族淡彩卡片按面板成组出现",
        "每张卡的描边都是自身填充色的加深版本"
      ],
      "weight": 18,
      "confidence": "high",
      "prompt_token": "分区用低饱和淡彩填充配同色系加深描边，一个模块一个色相、跨模块才换色，高饱和只留给图标和功能徽章"
    },
    {
      "id": "single-black-arrow-language",
      "dimension": "connectors",
      "rule": "全图只有一种关系符号：1.5-2px 纯黑实线加实心三角箭头，水平垂直走线、最多一次直角折弯、边缘起止、互不交叉；虚线仅用于包裹分组不表示关系；跨模块转折不用箭头而用大面积淡彩实心三角压在接缝处指向下游",
      "evidence": [
        "全部处理链路均为黑色细实线三角箭头",
        "面板之间出现无文字的浅桃色与浅紫色实心三角"
      ],
      "weight": 16,
      "confidence": "high",
      "prompt_token": "关系只用纯黑细实线实心三角箭头，直角走线边缘起止互不交叉，虚线只做分组，跨区转折改用大面积淡彩实心三角"
    },
    {
      "id": "flat-cartoon-and-geometry-same-weight",
      "dimension": "iconography",
      "rule": "扁平矢量插画语言，单个图标 3-5 个纯色块、无渐变无阴影无 3D、正面或轻微 3/4 视角、中等偏低细节；圆润简化的卡通人物胸像、具象对象图标、条形图坐标轴一类几何示意三者共用同一画法与视觉重量，统一置于白色微卡中央，图标与文字面积比约 1:1；题材从新内容实体与动作派生，无具象对象时退回几何示意",
      "evidence": [
        "人物胸像与器物图标、波形示意图并置且精细度一致",
        "所有图标都居中嵌在白色小方块内并在下方配短标签"
      ],
      "weight": 14,
      "confidence": "high",
      "prompt_token": "扁平纯色 3-5 色块图标，卡通人物胸像与对象图标、几何示意同一画法同一视觉重量，居中嵌在白色微卡内配下方短标签"
    },
    {
      "id": "loose-outside-tight-inside",
      "dimension": "density",
      "rule": "模块之间留出列宽 4%-6% 的白色沟槽，模块内部卡片紧密排列小间距；白底可见面积维持在 35% 左右；主模块 2-4 个、单模块内卡不超过 4 个、单内卡微卡不超过 4 个，短标签不超过 6 个汉字，只有输出示例卡允许 2-4 行完整句子",
      "evidence": [
        "面板间沟槽明显宽于面板内卡间距",
        "枚举网格高密度但每卡内边距充足"
      ],
      "weight": 12,
      "confidence": "high",
      "prompt_token": "模块之间留明显白色沟槽、模块内部紧密排布，形成外松内紧的密度节奏，白底可见面积约三分之一"
    },
    {
      "id": "bold-black-title-color-subtitle",
      "dimension": "typography",
      "rule": "无衬线双层文字编码：主模块标题最大字号 Bold 纯黑居中作为基准 1.0，内卡分区标题 0.65-0.7 倍 Bold 取所属强调色的同色系深色，微卡标签 0.45-0.5 倍深灰居中，相邻层级字号差不小于 25%；强调用下划线而非加粗或变色",
      "evidence": [
        "面板标题为粗黑居中大字",
        "卡内小标题分别呈绿紫橙蓝且与所在卡同色系"
      ],
      "weight": 11,
      "confidence": "medium",
      "prompt_token": "无衬线字体，粗体纯黑主标题配同色系彩色内卡小标题再配深灰微标签，层级差不小于 25%，强调只用下划线"
    },
    {
      "id": "micro-marker-checklist",
      "dimension": "components",
      "rule": "小型功能标记系统：黄色实心圆形序号徽章压在阶段卡左上角边线上，绿色或橙色实心圆形勾号贴住被校验项且该项文字加下划线，让方法图带上审校清单气质",
      "evidence": [
        "质控面板阶段卡左上角的黄色数字圆徽",
        "校验结论旁的绿色与橙色实心勾号配下划线词组"
      ],
      "weight": 9,
      "confidence": "high",
      "prompt_token": "阶段用黄色实心数字圆徽压在卡片左上角边线，校验结论用绿或橙实心勾号贴附并给该项文字加下划线"
    }
  ],
  "visual_system": {
    "layout": {
      "observations": [
        "宽幅横图，比例约 2:1",
        "多面板混合型：枚举网格、顺序流程链、输入-处理-输出结构、带序号的纵向质控栈并存",
        "宏观按纵列切分，内容轻的一列纵向再切成上下两个主模块，形成 2+1+1 的错位栅格",
        "阅读路径自左向右、列内自上而下",
        "视觉重心在中列的核心处理模块，占最大连续面积且内部留白更充裕"
      ],
      "transfer_rules": [
        "主模块数量、列的上下切分方式、箭头分支与汇聚形态全部按新内容关系重算，不锁定四栏",
        "保留纵列切分加列内自上而下的阅读节奏与对齐关系",
        "始终把最核心的处理环节放在视觉重心位置并给它最大连续面积",
        "四周留 2%-3% 画布宽的安全边距"
      ]
    },
    "components": {
      "observations": [
        "标题条与下方内容之间有明显缝隙、不共用边框",
        "宏观框为 1px 灰色短虚线圆角矩形、内部透明",
        "内卡圆角约 12-16px，微卡圆角 6-8px",
        "枚举属性用短横线引导的 2-3 条词组，不用圆点项目符号",
        "固定搭配是图标加一行短标签，以及彩色小标题加短横线词组列表"
      ],
      "transfer_rules": [
        "四级容器语法整体保留，不得压成同一种卡片",
        "卡内文字与边框之间至少留一个字高的内边距",
        "枚举一律短词组，不写长句"
      ]
    },
    "connectors": {
      "observations": [
        "只有一种箭头：纯黑细实线加实心三角",
        "走向以水平垂直为主，需要拐弯时一次 90 度折角",
        "分支从共同起点扇出，汇聚时多箭头指向同一条边",
        "虚线只做分组包裹",
        "跨模块转折用无文字的大面积淡彩实心三角"
      ],
      "transfer_rules": [
        "不引入曲线、贝塞尔、双向箭头或第二种线型",
        "箭头起止于卡片边缘，不穿越卡片内部、不交叉",
        "需要表达多种关系时用位置与分组区分，而不是增加线型"
      ]
    },
    "palette": {
      "observations": [
        "背景 #FFFFFF，可见白底面积约 35%",
        "标题条 #EFEFEF，虚线宏观框描边 #B5B5B5，微卡描边 #D9D9D9",
        "文字三级 #141414 / #2A2A2A / #4A4A4A",
        "箭头统一 #111111",
        "五族淡彩：蓝 #DCE9F7 / #9FC2E6 / #2B5FA8，黄 #FDF2DC / #E7C579 / #A9761B，绿 #E5F3E7 / #A6D2AD / #2E7D46，紫 #EDE6F8 / #B7A4DC / #6A46B0，粉 #FBE4EC / #EFA8C3 / #B03A6B",
        "功能色：序号徽章 #F5C518，通过标记 #2FB344，次级标记 #F08C2E"
      ],
      "transfer_rules": [
        "背景、结构灰、文字灰、箭头黑为稳定角色，可直接沿用色值",
        "五族淡彩作为中性强调槽位 A/B/C/D/E，按新内容的模块分组与层级重新映射，不绑定任何业务语义",
        "任何新增色相都必须落在明度 90%-96%、饱和度低于 25% 的同一区间内",
        "高饱和颜色总面积不超过全图 8%"
      ]
    },
    "typography": {
      "observations": [
        "全部无衬线，几何或中性字形",
        "标题 Bold 黑色居中，内卡小标题 Bold 彩色居中，微卡标签 Regular 或 Medium 深灰居中",
        "条目列表左对齐行高约 1.4，长文本行高约 1.5",
        "强调用下划线"
      ],
      "transfer_rules": [
        "可替换为 Helvetica、Arial、Source Han Sans、Noto Sans 一类，不猜品牌字体",
        "保持 1.0 / 0.65-0.7 / 0.45-0.5 的三档字号比例",
        "彩色小标题必须与所在卡片同色系，靠色彩分担层级"
      ]
    },
    "iconography": {
      "observations": [
        "扁平矢量，无描边或极细描边，单图标 3-5 个纯色块",
        "正面或轻微 3/4 视角，中等偏低细节，不刻画纹理",
        "人物为圆润简化的卡通半身胸像，同一套头身比与画法",
        "图标与文字面积比约 1:1，统一置于白色微卡"
      ],
      "transfer_rules": [
        "只保存画法不保存题材，图标题材必须从新内容的实体、对象与动作派生",
        "无合适具象对象时改用条形图、坐标轴、时间轴刻度、网格方阵、彩色方块序列等几何示意，仍用同一扁平纯色画法",
        "是否出现人物取决于内容是否涉及角色或人的行为，不硬塞",
        "所有图标视觉重量一致，不允许个别明显更精致"
      ]
    },
    "surface": {
      "observations": [
        "全平面处理，无渐变、发光、玻璃、投影和 3D 材质",
        "深度完全由描边、叠层与颜色对比产生",
        "无背景纹理、颗粒或装饰碎片"
      ],
      "transfer_rules": [
        "默认平面处理，这是风格偏好而非绝对禁令",
        "用户提供或内容必需的照片、Logo、外部插图允许插入，但要统一套用白色微卡边框、同一尺度与层级，色调向低饱和压一档"
      ]
    },
    "density": {
      "observations": [
        "每个主模块 2-4 个内卡，每个内卡 2-4 个微卡或 3 条以内词组",
        "高密度靠紧凑网格与层级压缩实现，而非缩小字号",
        "节奏是主次错落：中列聚焦、两侧重复"
      ],
      "transfer_rules": [
        "成图时把节点数与文字行数写成具体数字预算，防止微卡被长句塞满",
        "单标签不超过 6 个汉字或 2 个英文词，只有输出示例类卡片允许 2-4 行完整句子",
        "内容超预算时增加模块或拆列，不缩小字号"
      ]
    }
  },
  "transfer_boundary": {
    "layout_policy": "preserve-visual-rhythm-adapt-to-new-topology",
    "icon_subject_policy": "derive-from-new-content",
    "color_role_policy": "assign-by-new-content-hierarchy",
    "supporting_asset_policy": "allow-user-provided-or-content-required",
    "hard_constraints": [
      "preserve user-provided meaning and relationships",
      "keep all required text legible and accurate",
      "exclude source-specific content from new figures",
      "no cropping or occlusion of any card, icon or label",
      "no invented modules, steps, numbers or labels"
    ],
    "style_defaults": [
      "默认纯白背景与全平面处理，不用渐变、发光、玻璃、投影和 3D",
      "默认无衬线字体、圆角矩形容器、纯黑直角三角箭头",
      "默认低饱和淡彩分区，高饱和只留给图标内部与功能微标记",
      "默认四级容器嵌套且不超过四级"
    ]
  },
  "conditional_rules": [
    "内容涉及角色、使用者或人的行为时才出现卡通人物胸像，否则全部改用对象图标或几何示意",
    "用户提供或内容必需的 Logo、照片、真实截图可作为 supporting insert，需统一边框、尺度、层级并降低饱和",
    "需要表达质控、审校或多阶段验收时才启用黄色序号圆徽与实心勾号微标记系统",
    "单列内容过轻时才把该列纵向切成上下两个主模块"
  ],
  "anti_generic": [
    "不要把四级容器压成同一种卡片，必须保留脱开的标题条、虚线宏观框、淡彩内卡与白色微卡之间的填充与描边差异",
    "不要只复用马卡龙配色，配色必须与紧凑网格、纯黑直角三角箭头、扁平纯色插画同时出现，缺一项就会塌回普通信息图",
    "不要照搬四栏结构，按新内容拓扑重算分区数量与阅读路径，只保留对齐节奏与容器语法",
    "不要滑向深色底加霓虹发光线的科技海报，也不要滑向每个方框长得一样、只靠箭头串联的流程图线框稿"
  ],
  "source_exclusions": [
    "literal:SwanData",
    "literal:SwanData-Speech",
    "literal:MLLM",
    "源图的天鹅圆形徽标与其配套字标",
    "源图的语音数据集业务分区名称与阶段名称",
    "源图中的英文示例句、说话人标签与字幕文本",
    "源图中的具体人物形象与二次元角色设定"
  ]
}
