{
  "schema_version": "3.0.0",
  "references": [
    {
      "path": "../ref-macaron-dualtrack.png",
      "role": "style_reference",
      "notes": "1596x878 学术方法总览图，左窄栏 + 中部双轨 + 右侧结果面板"
    }
  ],
  "evidence_scope": {
    "reference_count": 1,
    "generalization": "single-reference-hypothesis"
  },
  "style_summary": "极淡马卡龙色块划分宏观分区，分区内用黑色细虚线圆角框做二级归组，最内层是白或浅色实线小卡片；彩色扁平轮廓图标配手写感圆头漫画体的短标签排成紧凑网格，成列图标背后垫浅灰圆形底盘；每条主链路用一种高饱和色的粗直角折线贯穿，反馈用灰色细虚线；整体高密度、无阴影无渐变，手写体让这套高密度技术图带上教学读物的亲和感。",
  "signature_anchors": [
    {
      "id": "macaron-panel-dashed-nest",
      "dimension": "components",
      "rule": "三级容器：最外层是无描边、大圆角、极淡马卡龙填充的宏面板；中层是黑色细虚线圆角框，无填充，只用来把若干图标归成一组；最内层是白色或浅色填充的实线圆角小卡片。三层的圆角依次减小，虚线框与宏面板边缘保持一圈明显内边距。",
      "evidence": [
        "淡黄宏面板内两个黑色虚线圆角框分别包住四个图标与三段式流程",
        "淡绿宏面板内三张带绿色实线描边的浅色卡片纵向排列",
        "左侧浅灰窄栏本身就是一个黑色虚线圆角框"
      ],
      "weight": 24,
      "confidence": "high",
      "prompt_token": "三层嵌套容器：无描边大圆角极淡色宏面板包住黑色细虚线圆角归组框，归组框内再放白色或浅色实线描边的小卡片，圆角逐层减小，每层之间留一圈明显内边距"
    },
    {
      "id": "side-rail-plus-stacked-tracks-plus-result-panel",
      "dimension": "layout",
      "rule": "横向画布分成三段：左侧一条很窄的竖向清单栏（约 10% 宽），中部是上下堆叠的两条并行主轨（约 55% 宽），右侧是一整块结果面板（约 30% 宽）。竖向清单栏底部写栏目名，中部每条轨在面板顶部居中写轨名，阅读路径左进右出。",
      "evidence": [
        "左栏六个领域图标竖排，底部写 Domains",
        "中部淡黄与淡粉两条轨上下堆叠，各自顶部居中标题",
        "右侧淡绿面板一整块承接两条轨的输出"
      ],
      "weight": 20,
      "confidence": "medium-high",
      "prompt_token": "横向画布分左中右三段，左侧窄竖栏做输入清单且栏名写在底部，中部上下堆叠并行主轨且轨名居中写在各自面板顶部，右侧整块面板承接结果，宽度比约 1:5:3"
    },
    {
      "id": "track-coded-thick-elbow-arrows",
      "dimension": "connectors",
      "rule": "每条主链路固定用一种高饱和色，画成较粗的直角折线，只走水平段和垂直段，端点是实心三角箭头，箭头正对容器边缘中点；跨轨的回流关系改用深灰色细虚线折线加小箭头，明显比主线细，从不与主线同色。",
      "evidence": [
        "橄榄绿粗折线贯穿上轨并直角转入右侧面板",
        "品红粗折线贯穿下轨，另有一条品红虚线向上跨轨",
        "灰色细虚线从右向左回指到虚线框内"
      ],
      "weight": 18,
      "confidence": "high",
      "prompt_token": "主链路用单一高饱和色的粗直角折线连接，只有水平与垂直段，端点为实心三角箭头对准容器边缘中点；反馈与回流改用深灰细虚线折线配小箭头，粗细明显小于主线"
    },
    {
      "id": "flat-outlined-icons-with-bold-caption",
      "dimension": "iconography",
      "rule": "图标是彩色扁平矢量插画，带深色描边轮廓，每个图标限 2 到 4 种颜色，一律正视角、无透视、无阴影、无渐变；成列排布的图标背后垫一枚比图标略大的极浅灰圆形底盘；图标尺寸互相接近，图标在上、手写体短标签紧贴在下方居中。",
      "evidence": [
        "左栏六个领域图标同尺寸、同描边、正视角",
        "中部机器人、齿轮、显示器图标均为扁平多色带轮廓",
        "每个图标下方都有一行粗体黑色短标签",
        "左栏六个领域图标背后各有一枚浅灰圆形底盘"
      ],
      "weight": 16,
      "confidence": "high",
      "prompt_token": "彩色扁平矢量图标，带深色描边轮廓，每个图标不超过四种颜色，一律正视角无透视无阴影无渐变，尺寸彼此接近，成列排布时在图标背后垫一枚略大的极浅灰圆形底盘，图标在上手写体短标签紧贴下方居中，形成统一的图标加标签单元"
    },
    {
      "id": "pale-fields-carry-saturated-accents",
      "dimension": "palette",
      "rule": "大面积用明度极高的淡色底（每块宏面板一种，明度约 92% 以上、饱和度很低）承载小面积高饱和强调色；文字分深炭灰与纯黑两档，虚线框为纯黑，强调色只出现在箭头、图标和卡片描边上，面积占比很小。",
      "evidence": [
        "淡黄 #FEFBE9 占约 25% 面积，淡粉 #F7EBEE 约 19%，淡绿 #EEF3EE 约 14%",
        "高饱和的 #C30066 与 #656600 合计不足 1% 面积",
        "黑色只出现在文字、虚线框与图标轮廓"
      ],
      "weight": 8,
      "confidence": "high",
      "prompt_token": "宏面板用明度 92% 以上的极淡低饱和色铺大面积底色，高饱和强调色只用在箭头、图标与卡片描边上且总面积很小，文字与虚线框保持纯黑"
    },
    {
      "id": "handwritten-comic-three-tier-type",
      "dimension": "typography",
      "rule": "全图使用同一款手写感圆头漫画体（Comic Sans、Comic Neue 一类），不是几何无衬线；笔画粗细不匀、末端圆润微收、字母宽窄与基线略有起伏，几乎全部加粗。字号只有三档：面板标题最大且为深炭灰 #333333，节点标签次之且为纯黑 #000000，卡片内文字与轴名最小。标签最多两行、居中对齐。",
      "evidence": [
        "Track1 标题的 T、k、1 笔画粗细不匀，末端圆润且略有倾斜",
        "Source Corpus 的 S 与 C 收笔处呈手写式微收，字母宽度不等",
        "左栏 General、Math 等标签基线略有起伏，与几何无衬线的等宽等高明显不同",
        "标题区取色为 #333333，节点标签区取色为 #000000"
      ],
      "weight": 14,
      "confidence": "medium-high",
      "prompt_token": "全图使用一款手写感的圆头漫画体，笔画粗细不匀、末端圆润微微收笔、字母宽窄与基线略有起伏，几乎全部加粗，字号只分面板标题、节点标签、卡片内文字三档，面板标题用深炭灰 #333333，节点标签用纯黑 #000000，标签最多两行居中对齐"
    }
  ],
  "visual_system": {
    "layout": {
      "archetype": "并行双轨加侧栏与结果面板的混合型",
      "canvas": "横向，约 16:9",
      "margins": "四周留窄边距，宏面板几乎顶到画布边缘",
      "focal": "视觉重心落在中部双轨的交汇与右侧结果面板之间",
      "observations": [
        "横向画布分左中右三段，宽度比约 1:5:3",
        "左侧窄栏标题写在底部，中部两条主轨标题居中写在面板顶部",
        "阅读路径左进右出，视觉重心落在中部与右侧之间"
      ],
      "transfer_rules": [
        "分区数量、每条链路的节点数与宽度比按新内容重算"
      ]
    },
    "components": {
      "macro_panel": "无描边，圆角约面板高度的 4%，纯淡色填充",
      "group_frame": "黑色细虚线，圆角矩形，无填充，线宽约 2px，虚线段较短",
      "inner_card": "白色或浅色填充，实线彩色描边，圆角较小，内边距均匀",
      "observations": [
        "无描边大圆角淡色宏面板",
        "黑色细虚线圆角归组框，线宽约两像素，无填充",
        "白色或浅色填充加实线描边的最内层小卡片",
        "图标在上、粗黑短标签在下的固定搭配"
      ],
      "transfer_rules": [
        "容器语法固定，容器数量随新内容的分组数变化"
      ]
    },
    "connectors": {
      "primary": "粗实线直角折线加实心三角箭头，按链路上色",
      "secondary": "深灰细虚线折线加小箭头，表示回流与反馈",
      "routing": "沿面板留白走线，绕开文字与图标，尽量不交叉",
      "observations": [
        "粗实线直角折线加实心三角箭头，按链路上色",
        "深灰细虚线折线加小箭头表示回流",
        "折线沿容器之间的通道走，尽量不交叉"
      ],
      "transfer_rules": [
        "每条新内容主链路分配一种强调色，反馈关系一律降级为深灰细虚线"
      ]
    },
    "palette": {
      "background": "#FFFFFF",
      "field_a": "#FEFBE9",
      "field_b": "#F7EBEE",
      "field_c": "#EEF3EE",
      "rail": "#F5F5F5",
      "card": "#D7E8D3",
      "ink": "#000000",
      "accent_a": "#656600",
      "accent_b": "#C30066",
      "accent_c": "#3897DE",
      "accent_d": "#F5A600",
      "observations": [
        "淡黄 #FEFBE9 约占 25% 面积，淡粉 #F7EBEE 约 19%，淡绿 #EEF3EE 约 14%",
        "高饱和的 #C30066 与 #656600 合计不足 1% 面积",
        "文字与虚线框一律纯黑 #000000"
      ],
      "transfer_rules": [
        "背景、墨色与淡色底保持稳定角色，强调色按新内容的分组与层级重新映射"
      ]
    },
    "typography": {
      "family": "手写感圆头漫画体，Comic Sans MS、Comic Neue、Patrick Hand 一类；中文可用手写圆体或圆润卡通黑体",
      "scale": "面板标题约为图标标签的 1.4 倍，节点标签约 1.2 倍",
      "weight": "几乎全部粗体",
      "ink": "面板标题 #333333，节点标签 #000000",
      "observations": [
        "Track1 标题笔画粗细不匀、末端圆润微收，字母略有倾斜",
        "Source Corpus 等标签字母宽窄不等、基线起伏，是手写感而非几何无衬线",
        "字号只有面板标题、节点标签、卡片文字三档",
        "面板标题取色 #333333，节点标签取色 #000000"
      ],
      "transfer_rules": [
        "字体必须保持手写感圆头漫画体，字号档位与对齐方式保持不变，字数按新内容压缩"
      ]
    },
    "iconography": {
      "family": "扁平多色带轮廓的信息图图标",
      "detail": "中等细节，不写实、不三维",
      "subject_policy": "题材从新内容的实体与动作派生",
      "observations": [
        "扁平多色带深色轮廓的信息图图标",
        "每个图标二到四色，正视角，无透视无阴影",
        "所有图标外接尺寸彼此接近",
        "成列排布的图标背后垫一枚极浅灰圆形底盘"
      ],
      "transfer_rules": [
        "只沿用图标的画法与图文关系，题材从新内容的实体与动作派生"
      ]
    },
    "surface": {
      "shadow": "无",
      "gradient": "无",
      "texture": "无",
      "depth": "深度只靠嵌套层级与描边对比产生",
      "observations": [
        "无阴影、无渐变、无发光、无纹理",
        "深度只靠嵌套层级与描边对比产生",
        "装饰性元素权重为零"
      ],
      "transfer_rules": [
        "默认保持纯平面处理，用户提供的外部素材才作为条件分支融入"
      ]
    },
    "density": {
      "per_zone": "每个宏面板 2 到 3 个归组框，每个归组框 3 到 4 个图标单元",
      "rhythm": "紧凑网格，局部留白只出现在走线通道上",
      "observations": [
        "每个宏面板两到三个归组框，每个归组框三到四个图标单元",
        "紧凑网格，留白只出现在走线通道上",
        "视觉节奏为均匀重复加局部聚焦"
      ],
      "transfer_rules": [
        "密度上限固定，节点数量按新内容确定但每组不超过四个图标单元"
      ]
    }
  },
  "transfer_boundary": {
    "layout_policy": "preserve-visual-rhythm-adapt-to-new-topology",
    "icon_subject_policy": "derive-from-new-content",
    "color_role_policy": "assign-by-new-content-hierarchy",
    "supporting_asset_policy": "allow-user-provided-or-content-required",
    "hard_constraints": [
      "内容准确，关系方向与类型正确",
      "不编造未给出的阶段、指标、数据与结论",
      "所有文字清晰可读，无错字、无重影、无乱码",
      "容器与文字不被画布边缘裁切"
    ],
    "style_defaults": [
      "默认纯平面处理，不加阴影、渐变、发光与玻璃质感",
      "默认手写感圆头漫画体，面板标题深炭灰、节点标签纯黑",
      "默认高密度紧凑网格而非大留白排版"
    ]
  },
  "conditional_rules": [
    "内容含定量结论时可在结果分区放一张带彩色实线外框的小图表，图表内文字更小一档",
    "用户提供 Logo 或照片时统一套用小卡片的圆角、描边与尺度后再插入"
  ],
  "anti_generic": [
    "不要把三级容器压成一种卡片，宏面板、虚线归组框与实线小卡片必须保持可见层级差",
    "不要只复用马卡龙配色，必须同时复用粗直角折线箭头、扁平轮廓图标与紧凑网格",
    "不要机械照搬左中右三栏，分区数量按新内容重算，但保留窄栏与主轨的宽度反差",
    "不要把箭头画成细线或曲线，也不要让主线与反馈线同色同粗",
    "不要把手写感圆头漫画体换成 Helvetica、思源黑体一类的几何无衬线，字体一换整张图立刻塌回普通商务信息图"
  ],
  "source_exclusions": [
    "literal:DataFlow",
    "literal:Data Construction",
    "literal:Data Quality Evaluation",
    "literal:MMD",
    "literal:Llama",
    "literal:Qwen",
    "literal:Mistral",
    "literal:UltraChat",
    "literal:WizardLM",
    "literal:OpenHermes",
    "literal:Infinity-Instruct",
    "literal:Data Quality Score",
    "第三方厂商 Logo 与模型名",
    "散点图中的具体数据点与 R 方数值"
  ]
}